id;nome;descricao;data_criacao;usuario_criacao
1;mobile Fish;Home Loan Account Table Computer;2019-05-11T12:53:46;FTP Savings Account
2;deposit Tasty Metal Bacon Implementation;Chips;2019-05-11T09:53:19;methodology Albania
3;Home Namibia;Steel zero administration;2019-05-11T05:29:51;Common
4;Savings Account syndicate Planner;Refined Rubber Chicken Table;2019-05-11T12:43:44;Factors
5;South Dakota envisioneer Music;Nakfa;2019-05-11T03:43:36;Rubber Buckinghamshire Games
6;incentivize Tuna copy;Costa Rica Mayotte;2019-05-11T09:51:13;Facilitator
7;Views e-enable Communications;National Awesome sky blue;2019-05-11T13:12:17;software scale interactive
8;Louisiana Specialist Home Loan Account;Plastic;2019-05-10T19:02:16;Small
9;deliverables reinvent 24 hour;overriding;2019-05-10T21:19:33;application quantify Unbranded Plastic Tuna
10;Internal;Investment Account archive Fantastic Plastic Chicken;2019-05-11T06:29:09;pixel withdrawal
